<?xml version="1.0" encoding="UTF-8"?>
<zen:book-Info xmlns:xsi="http://www.w3.org/2001/XMLSchema-instance" xmlns:zen="http://www.zensar.com/Books" xsi:schemaLocation="http://www.zensar.com/Books Books.xsd ">
  <zen:book>
    <zen:book-id>1235</zen:book-id>
    <zen:title>Harry Potter : Sorcerer's Stone</zen:title>
    <zen:author>J K Rowling</zen:author>
    <zen:publish-date>1997-01-01</zen:publish-date>
  	  
  </zen:book>
  <zen:book>
  <zen:book-id>1236</zen:book-id>
    <zen:title>Harry Potter : The Chamber of Secrets</zen:title>
    <zen:author>J K Rowling</zen:author>
    <zen:publish-date>1998-01-01</zen:publish-date>
  </zen:book>
  <zen:book>
  <zen:book-id>1237</zen:book-id>
    <zen:title>Harry Potter : The prisioner of Azkaban</zen:title>
    <zen:author>J K Rowling</zen:author>
    <zen:publish-date>1999-01-01</zen:publish-date>
  </zen:book>
  <zen:book>
  <zen:book-id>1238</zen:book-id>
    <zen:title>Harry Potter : The Goblet of Fire</zen:title>
    <zen:author>J K Rowling</zen:author>
    <zen:publish-date>2000-01-01</zen:publish-date>
  </zen:book>
  <zen:book>
  <zen:book-id>1239</zen:book-id>
    <zen:title>Harry Potter : The Order of Phoenix</zen:title>
    <zen:author>J K Rowling</zen:author>
    <zen:publish-date>2003-01-01</zen:publish-date>
  </zen:book>
  <zen:book>
  <zen:book-id>1240</zen:book-id>
    <zen:title>Harry Potter : The Half Blod Prince</zen:title>
    <zen:author>J K Rowling</zen:author>
    <zen:publish-date>2005-01-01</zen:publish-date>
  </zen:book>
  <zen:book>
  <zen:book-id>1241</zen:book-id>
    <zen:title>Harry Potter : The Deathly Hollows part1</zen:title>
    <zen:author>J K Rowling</zen:author>
    <zen:publish-date>2007-01-01</zen:publish-date>
  	</zen:book>
  	<zen:book><zen:book-id>1242</zen:book-id>
    <zen:title>Harry Potter : The Deathly Hollows part2</zen:title>
    <zen:author>J K Rowling</zen:author>
    <zen:publish-date>2011-01-01</zen:publish-date>
  	</zen:book>
</zen:book-Info>
